{
  "schema_version": 1,
  "contract": "subagent-response-v1",
  "_marker": "00000000-0000-4000-8000-000000000000",
  "status": "ok",
  "agent": "editorial-cro",
  "summary": "Plan risks OK. Tighten phase3 verify.",
  "artifacts": ["<project>/.cursor/docs/plans/2026-05-08-topic.md"],
  "findings": [
    {
      "severity": "med",
      "category": "editorial",
      "file": "<project>/drafts/outline.md",
      "line": 12,
      "note": "voice drift vs brand.md — align hook",
      "fix": "add ref to brand/voice in outline intro"
    }
  ],
  "next_actions": ["patch plan v1 phase3 verification", "re-run critic pass2"],
  "errors": [],
  "token_stats": { "out_words_est": 120, "tool_calls": 2 },
  "open_questions": [],
  "memory_writes": [],
  "degraded_reason": "",
  "reported_by": ["editorial-cro", "cco"]
}
